,Review,Analysis
0,,Neutral
1,,Neutral
2,,Neutral
3,course riff tease make fun certain thing summary line though truth especially consider last third movie quite fantastical pun intend much may see bus scene already imagine many time still quite highlight work wonder even trailerteaser reveal plot character movie able watch imax screen let tell wow also wow much respect marvel feige anyone involve dare make first ten minute chinese throw lot chinese term slang well throughout give touch authenticity immigrant america anywhere else world grow greek germanenglish also nice prone sarcastic really think good thing major big representation especially nowadays antiasian hatecrime rise people blame china people china virus movie topic entertainment every promo interview actor involve something mention good good u make bite bias come mcu get pure theatrical release instead black widow treatment also available disney plus cinema time issue come watch big screen dissapointed wait stuff drop especially mid credit scene tease credit scene might also hint something bigger tease midway credit actually almost begin honest sit back enhoy movie really funny character quite familiar face mcu previous entry also asian cinema well do,Positive
4,expect vision film along line snake eye date bagel four course banquet fast pace energetic relentless particularly genre normally go enjoy love every second visual masterpiece superb act terrific music produce magical way stun plan see understand bit little go watch youll love,Positive
5,,Neutral
6,find film engage start finish couldnt get eye screen kung fu good visual effect wonderful enjoy every second film,Positive
7,enjoy series wong karwei film great see star many classic feature tony leung feature superior fantasy adventure man magical allpowerful ten ring two estrange child son shaun simu liu lively altercation heavy san francisco bus realise impend danger seek independently mind sister know family somewhat unwillingly reunite work together rescue late lament mother clutch evil protect benign society lead michelle yeoh honest story isnt best actually little bite simple predictable say however characterisation engage action scene well stag pace interest underlie premiss resonate planet appear fight back mankind accumulate indifference elysian utopia xu wenwu leung must invade rescue wife symbolic unspoilt element planet intention roll peaceably whilst impose production standard typically high plenty cute dangerous beasties suit please age also quite fun series scene sir ben kingsley liverpudlian poet maybe accent isnt best stylishly craft finale tell thoroughly entertain watch two hour fly,Positive
8,ten year since shangchiliu charm stoic last saw father leader criminal empire ten ring wenwuleung charismatic enough feel lot empathy even terrible thing desperately want stop also last spend time sister xialingzhang badass deserve screen time honestly id surprise didnt future project he join friend katyawkwafina quirky provide lot comic relief something im tell shes general adept best describe tense reunion allow movie really mine family melodrama one best element wont give away exactly antagonist intend hero stop however figure maybe even even possible quite yet almost black panther asian audience lot representationincluding woman best character female addition two ive already mention also ying nanyeoh wise positively drench chinese culturethe third act way feel like belong completely different film first two take especially deep dive ultimately present western lens clearly need go direction still big deal put much estimate million major blockbuster see million people would never consider watch art picture especially one focus group dont belong point countless time make sense major character speak mandarin rather english subtitle dont worry think follow important white people screen arent make le actioneach sequence feel distinct belong rest memorable pay tribute many different kind martial art film acknowledge stand shoulder giant jackie chan wuxia etc choreography match skill cinematography see incredible fight camera dynamic celebrate highlight incredible hire bill pope director photography matrix trilogy two sam raimis spiderman entry darkman team america special effect excellent issue pace certainly chunk compose almost entirely flashback feature relatively brief highly concentrate surprisingly graphic goreyou know time fact happen be clearly human wasnt enough get away kind thing pg13 rat pepperidge farm remember well little strong language recommend fan comic book movie adaptation people passionate diversity hire,Positive
9,,Neutral
10,,Neutral
11,u government almost topple pretender name orange wenwu tony leung quote typical lighthearted also serious addition mcu shangchi legend ten ring although marvel always le serious dc time leave superman batman cry cap sweet superhero seanshangchi simu liu humanity almost hero use martial art press open sequence bus see bad come cinematic bus rid nobody rouse entertain fight sequence laugh balletlike composition satisfy set character motivation thing get heavy sean must confront potentially kill 1000yearold mobster dad wenwu awkwafinas katy seans girlfriend amuse oneliners throughout adventure right lifesaving shoot big end battle scene director destin daniel cretton deftly orchestrate fight character line authority much season filmmaker never lose sight central motifthe affirmation family primacy potential chaos giant cast multiple plot strand host unity glue character dialogue shangchi marvel whole family especially cinephiles curious marvel cinematic universe diverse entertain perfect purveyor heroic fantasy,Positive
12,,Neutral
13,watch imax entire movie expand aspect ratio youre watch image normal screen plus way smaller screen worse speaker promise worth wowowowowow movie blow away love lot begin end everything walk movie hype silentscreaming mask walk car since walk movie happy much say love mcu lot thing frequently lack one good fight scene always awesome action scene specifically fight scene usually pretty good great movie like civil war winter soldier general fight scene american movie pale comparison asian cinema ip man raid redemption anything jackie chan fight scene movie describe amaze martial art thats fast clear film creative astonish way without hint shaky cam quick cut stunningly beautiful backdrop phenomenal continuously focus fight instead cut different scene second like ive notice mcu far best fight mcu even close john wick series netflixs daredevil best weve see america lately love first major fight scene much worry would best one movie far early lol stupid sometimes another frequent flaw mcu lack compel villain nope awesome awesome awesome thats ill say another frequent complaint musical score exception dont stand think hear theyre good streak show black widow amaze loki score like felt unique new franchise still much say need go faster one best maybe best story mcu especially way tell love character love cast choice love performance scene dialogue give goosebump emotional moment hit callback hit isnt anything didnt work there thing perfect movie mannnnnn lmao didnt mention cinematography would wait long mesmerize lot throughout candy eye also nice see wellwritten comedy joke relevant scene character feel organic oppose insert joke method weve see especially far home whats opposite formulaic thats movie never know expect next help didnt watch single trailer ruin movie definitely doesnt feel like typical mcu movie unique tone feel character continue say headline thing get goosebump start tear emotional moment scene incredible especially action scene dont know happen dont know happen ppl maybe partly cant risk blink happen movie numerous time like coolest thing ive ever see life hyperbole mannnnn endgame finish phase yes know spiderman happy satisfy mcu wasnt sure could ever recapture magic know would watch everything would probably mostly awesome wasnt expect toptier stuff lol stupid sometimes ecstatic notion obliterate top mcu movie wow adore movie may wonder wouldnt give rave 10 super rare watch thousand movie interstellar inception mad max fury road etc movie shouldnt even call movie 9 rare favorite movie 10 favorite favorite superhero movie ive give 10 dark knight dark knight rise civil war youre still read wow youre awesome think longest review interstellar im still good mood cant wait watch imax want wait week feel fresher might able view,Positive
14,shang chi nowhere near top anticipate mcu film year surprise film date load pulse pound action camera friendship turn possible romance genuinely care lead absolutely see take place someone like chris evans face mcu year come absolutely brilliant work art,Positive
15,good far top10 list movie however wasnt rly hook joke seem outdated scene rush like visuals thats expect marvel,Positive
16,movie feature lesser know marvel superhero shangchi who former assassin china hide usa go back china assassin come also sister turn father real mandarin sadly doesnt get meet iron man impersonator iron man play ben kingsley lot fun nice throwback older marvel film good way satisfy fan like there two people gender love interest get absolutely amaze fight scene seem right classic chinese martial art movie complaint bite long still amaze gorgeous design creature truly unique film mostly allasian cast superhero movie recall interview actor say lot chinese people call bruce lee make documentary problem apu even idiotic,Positive
17,real concept character story didnt really know expect shangchi legend ten ring pleasantly surprise marvel action film average feature impressive visuals engage action scene entertain character miss piece story may save later overall enjoy introduction new mcu superhero,Positive
18,daniel destin cretton create tranquil really well film marvel story drive fun time simu liu surprise character best along awkwafina always delightful really appreciate direction everything especially effect action cinematography silliness good might odd understandable one best marvel film,Positive
19,shangchi legend ten ring action fantasy movie watch new era marvel studio rise shangchi master kung fu face past involve ten ring organization crate future accordingly admit doubt movie prove wrong since amaze movie beautiful interest plot keep tense whole duration consist plenty action nice cgis one time marvel succeed create nice atmosphere connect previous movie one many easter egg expect near future interpretation simu liu play shaun shangchi simply outstanding make difference interpretation mention tony chiuwai leungs play xu wenwu michelle yeohs play ying nan menger zhangs play xialing awkwafinas play katy comic relief role ben kingsley trevor slattery brilliant idea also give something different movie finally say shangchi legend ten ring amaze movie strongly recommend everyone watch especially fan marvel,Positive
20,star shangchi legend ten ring awesome excite mcu film bring stun world asian culture say enjoy previous mcu film black widow shang chi introduce new mcu character play simu liu awkwafina also fun addition chase organization call ten ring lead father tony leung shang chi learn ability ten ring father try use power personal reason great epic plot shang chi katy awkwafina enter hide world ta lao magical mythical creature like wow stun moment first see wakanda black panther film give emotional story build villain relatable cast ensemble great simu liu great character along awkwafina friend menger zhang michelle yeoh benedict wong florian munteanu tong leung great set design visual effect stun great colorful moment music score good well action sequence great excite every set piece awesome martial art choreography well shoot cinematography director great job capture action fight sequence even epic climax dragon battle two mid post credit scene set film fun nod mcu say shang chi great excite addition find film fast move action pack great family conflict story emotionally drive,Positive
21,show sign slow hot heel black widow raft wellreceived disney series arrive far front hotly anticipate eternals marvel continue put work put many wheelhouse shame marital art infuse shangchi legend ten ring yet another entry brand increasingly load catalogue quality blockbuster release hard pinpoint exactly marvel keep maintain momentum start year ago 2008s iron man absolutely correct many say lot origin story event picture follow set formula b ability attract best actor work industry today handpicking raft excite hollywood filmmaker around marvel strike gold incredibly fun inventive shangchi quite possibly visually sumptuous marvel film yet sometimes feel marvel meet ang leeyimou zhang mind marvel film feature best choregraphed action scene yet spectacle heavy brand shangchi big screen blast freshly direct upcoming destin daniel cretton get reward great debut short term sadly undervalue glass castle come bigbudgeted ride infuse film great energy charm enhance work lead simu liu career launch turn likable hero shaunshangchi awkwafina usual fun schtick shauns bestie katy tony leung unfortunate villain piece xu wenwu cretton turn perfect choice start cinematic journey fist swing shangchi help instill film nice difference weve come expect comic book blockbuster modern era notably film excite use hand hand combat deliver spectacularly two stand sequence board move bus better alongside high rise build macau set piece easily noteworthy marvel film yet also benefit film asian infuse eccentricity fun relationship shangchi katy never bother add extra baggage add weight believable fun friendship major drawback shangchis many win overdraw finale major problem many acknowledge previously come marvel film cretton team cant quite stick land shangchi little long tooth good slightly overblown feature incredible imagery technical wizardry film riproaring start strong middle section give way something lesser final say another huge win marvel help director destin daniel cretton talented cast create instantly likable cinematic universe provide comic king one unique excite playground yet chickenpigs,Positive
22,shangchi legend ten ring brief review yet another superb standalone superhero flick mceus kitty mceus new phase never look promise product deliver better expect spider man flick right endgame change many perception marvel future even though couple recent series like wanda vision loki couldnt emerge clear winner set solid base upcoming new story shangchi new start mean come new phase mainly standalone film new superhero like use traditional combat method along ancient superpower captain america black panther begin standalone film promise much thankfully fulfil shangchi may promise much like steve rogers wakanda story point end surely give u hint new assemble version superheroes multiverse shangchi master unarm weaponrybased kung fu force confront past draw ten ring organization film major portion cover family value hence may look predictable bore yes scene outdated dramatic watch superhero film make 90 let forget weak point shang chi excel visual spectacle screenplay could better second half big war suppose take place actually look tiny one except two humongous dragon might remind hobbit performance simu li awkwafina menger zhang fala chen florian munteanu fine accord le potential available role actually humour tone character great look normal people fight even though film ancient refrences character dont actually go deep become expressive director destin daniel cretton seem slightly track begin try humanise character typically teenage humor film go ahead recover childish entanglement super explosive climax surely make mistake rather make u forgive overall shang chi another superb entertainer marvel fanboys even neutral gonna enjoy rat samthebestest,Positive
23,action great except cacophonous dragon fight act decent visuals good story predictablethe whole fine press matter address yet watch mcu movie felt like get enough wong wong always wong,Positive
24,first time couple year since 2019s captain marvel mcu introduce u brand new hero simu liu rather impressively first ask role twitter bring u shangchi film perhaps issue end ultimately fun funny ride type marvel perfect last year talented somewhat aimless shaun simu liu live san francisco work valet friend katy awkwafina he attack bus he force back world father ruthless terrorist xu wenwu tony chiuwai leung first visit sister return ten ring compound shangchi decide use skill defend late mother sacred homeland invasion father control ten mystical arm ring weapon grant owner immortality unearthly power black widow consider wobble mcu despite fact think perfectly fine film important come back something undeniably excellent shangchi perfect balance humour action marvel establish last year action tweak slightly closely resemble type asian lead action film weve see previously jackie chan style bus fight crouch tiger hide dragonesque flashback fight shang chi parent there lovely link wider mcu include return benedict wongs wong trevor slattery ben kingsleys iron man character whose masquerade role mandarin one mcus divisive moment perfect end perhaps little rush lack moment two redemption earn xu wenwu peak future character ring organisation interest addition plus first real step might route next big bad excellent stuff,Positive
25,shangchi legend ten ring star simu liu lead role alongside heavy name tony leung michelle yeoh latest installment marvel cinematic universe lius shangchi must come son legendary mandarin leung owner ten ring like film style director destin daniel cretton mix chinese wuxia setting aesthetic hong kong wire kung fu inspire action set piece still keep feel like marvel film there surprise amount callback nod larger marvel universe please dedicate fan film still able stand foot introduce u hero kudos also whole film action scene little shaky cam jump cut especially hand hand scene exactly id dare say film best action set piece mcu one thrill visually spectacular end battle well come think furthermore act solid especially liu leung awkwafina play shangchis american friend menger zhang xialing shangchis younger sister perhaps real gripe film could use either bite edge alternatively lot le seem flipflop relatable aggravate best marvel movie mean thats really high bar clear simply say base im optimistic mcus continue future,Positive
26,better proceed marvel movie black window exceed expectation marvel movie shangchi feel like marvel movie experience start get back normal theme ride martian scorsese believe cant disagree note thats want comparison shangchi lower level character fan marvel comic get reference marvel cinematic universe movie direct comic book reference marvel cinematic universe reference amaze enough get fact obvious comic book one go head mean movie connection movie great fanfare make love really cool cameo happen actually move story along like mandarin feel copy paste lot thing story shangchi make complete movie lower level character little know character fit netflixs show year back change enough justify blockbuster succeed make shangchis background fuller relationship father sister beautiful complex importantly never bore course awkafina comedy relief best friend shangchi strategic gold story background full really character drive movie without amaze performance group actor know stuff story would fall short note love fact michelle yeoh movie give lot shes do way better le effective film likely get huge paycheck disney wave hand around special effect good flick impress use make final conflict convince dude kims convenience master kung fu good movie live high expectation give lot cool thing really give anything see movie better anything spend rest day pretend know kung fu,Positive
27,,Neutral
28,elude difficult past young man china content play safe san francisco past several year even though lack true sense self drastic circumstance draw back conspicuous origin choice face demon head continue expand cultural horizon mcus first asiancentric movie unique choreography dazzle visual scheme splendid handtohand combat course expect tease go forward elaborate action set piece lack need tension much exposition backstory isnt engage third act many emotional aspect narrative arent rich compel could humor strain efficiently cast provide enough distinctive entry marvel world Â½,Positive
29,,Neutral
30,,Neutral
31,seem one marvel latest marvel studio offer movie technically sound visual effect stunt work sound cinematography name find mostly rehash thing ive see maybe im get tire superhero movie,Positive
32,shangchi legend ten ring movie wife recently watch theatre storyline movie follow young man best friend work park attendant one day attack super villain dig young man past discover father behind attack purpose hopefully brine family back together movie direct destin daniel cretton mercy star simu liu blood water tony chiuwai leung infernal affair ben kingsley iron man michelle yeoh crouch tiger hide dragon awkwafina crazy rich asian storyline movie way better crazy depth around character really understand behind every circumstance perspective act outstanding character perfectly portray special effect awesome term action scene backdrop dragon may bite overdo choreography also excellent see yeoh really make smile movie way better worthwhile addition marvel universe id strongly recommend id score solid,Positive
33,bring martial art franchise well breath fresh air marvel showcasing series excellent action sequence intelligent mind hide origin story fantasy scifi feature shangchi legend ten ring one best mcu film protip point live seek gem go solid uhd hdr bluray 3d impressive albeit minor crosstalk forgivable intricate set piece leave right eye navigate via post conversion 3d well do visuals absolutely stun comedic relief always point fight sequence sleek yet powerful story arch well pace unfold gradually one get emotionally involve film character act superb front film talented ensemble direct pace spot shangchi legend ten ring easily top origin film franchise give u one favorite entry whole youll leave theater satisfy,Positive
34,next instalment mcu shangchi legend ten ring come manage see day finally find time review review premise film see young martial artist force face past criminal father come hunt main character relative unknown simu liu play shangchi really good role really deliver strong performance come film really like care character shangchi focus family dynamic really well do liu great job sell show pain life bring great hero life also fantastic action scene huge part film believe hero capability really support character awkwafina play best friend katy feel like character really go split opinion hate love pretty much hit end spectrum think really annoy first act film hurt enjoyment role slightly lessen become much likeable character arc become clear tony leung play first role american film play wenwu one best antagonist current mcu love character performance isnt generic bad guy time really understand motivation saw emotion performance really strong menger zhang play xialing like character think really complement shangchi really well clearly issue film play well make female sidekick give personality story story strongest focus family issue character particular shangchi wenwu father son dynamic great actor deliver really well role make clash feel even important genuinely care film issue film kind stray away try focus much plenty exposition scene fit much distract main thing make film great final act put focus wrong place hard explain without spoiler think know mean watch film script script okay drama really well do make care character emotional predicament put adventure actually think film hold back little bite fact mcu mean humour come expect universe do poorly never really laugh disappointment style film look fantastic cgi beautiful think excellent job build world martial art different element mcu fight scene live hype best see marvel cinematic universe flow well hard hit easily best element film overall overall shangchi legend ten ring great film another solid addition marvel cinematic universe isnt top tier marvel great job introduce new hero shangchi,Positive
35,car valet liu friend attack warrior work father year old owner ring give phenomenal power sister eventually capture father reveal strange intention fit wonderful action pack fantasy adventure brilliantly buy life great cast great action sequence include staggeringly beautiful fantasy scene extraordinary almost child like fantasy film successfully bridge chase scene across modern day san francisco battle dragon whilst maintain goodly degree drama snd humour huge fun,Positive
