,Review,Analysis
92,think film good break usual marvel super hero film much traditional martial art film combine modern aspect concept good film go along great pace good humour well would really recommend,Positive
93,movie first start felt like watch foreign film english chinese english subtitle didnt know expect movie later cast start speak english awesome fight scene kick omg excite fight choreography unbelievable good jackie chan movie storyline alright cg good use lot chinese culture tradition costume symbol look forward see next sequel,Positive
94,shangchi legend ten ring follow formula thats present audience typical marvel film say shangchi give exactly expect better worse trick movie sleeve surprise film deliver standard wellexecuted superhero film whether enjoy completely one sick standard marvel setup admit superhero fatigue unfortunately shangchi follow typical superhero setup mean extremely bland film character plot spark light along tease compel movie best part shangchi involve tony chiuwai leung play surprisingly complex sympathetic villain star scene echo badassery asian gangster flick one scene take room full villain intense wish movie wouldve follow plot line instead subpar narrative leave yes tony great everything else shangchi mediocre include titular hero ironman spiderman black widow hulk dr strange marvel superheroes immediately picture distinctiveness character black widow sexy badass assassin spiderman naive pure hearted schoolboy ironman cocky billionaire shangchi he um actually thats exactly youll ask shangchi barely personality film character dull forgettable say way slight simu liu he fine role script favor come character awkwafina movie honestly excite see good farewell wow excitement lead astray fun entertain prostate exam mean sweet jesus grate consider stuff popcorn ear didnt listen speak anymore joke werent funny dialogue awful im sure improvise character plain annoy shangchi also bore film stuff poor dialogue load exposition nod theatre lot line cheesy poorly deliver find roll eye shangchi also amount bland uncreative edit film present lot marvel film character walk room room talk subject subject fun entertain let face horrendously bore okay youre will look past action good get action first act movie two good action sequence youve see trailer bus fight scaffold fight hope youre big fan kungfu two fight longer get wellchoreographed action instead treat horrific cgi battle im talk ringonring action unnecessary giant monster fight place purpose movie bore watch mean basically first ever kungfu superhero movie decide include two scene kungfu creator think shangchi legend ten ring exercise disappointment instead attempt something different film exactly youd expect hey love kind movie youll likely love film thats great hope youre tire exact formula superhero movie follow shangchi wont manage lull superhero fatigue,Positive
95,good action movie firstly scenario pretty good nothing special little bite predictable secondly cast awesome really like akwafina role funny also like simu lu main character charismatic person favourite one character past film mcu dont want give spoiler thirdly like atmosphere ancient chinese culture show want fourthly fight good nice mcu film,Positive
96,marvel supply fan fast fresh funny superhero adventure unconditionally perfect amount exhilarate action fascinate character enthusiasm noticeably kick sustainable write appeal plot arrange excellent protagonist prop secondly director destin daniel cretton recieves role brilliantly execute visuallyawakening tale there doubt real magic belong epic sequence fantastical action stylish martial art battle superb effect shangchis epic movie live hype genre however ridiculous unnecessary detail also significant announce fact amount action perfect there much point tedious le point remember dialogue marvel flick usually include several moment bland dialogue superheroes occasionally grow fairly unexciting surprisingly grip entertain adventure rule alongside massivelypraised action humour heartpumping credit scene like review check full review review aussieboyreviews,Positive
97,marvel movie end try hard enormous become visually impossible comprehend would like one superhero movie character think talk way threat humanity nevertheless one better attempt primarily well act origin story minimal amount heart soul thankful small mercy,Negative
98,let preface say enjoyment movie may dampered poor night sleep say middle minute film nearly fall asleep literally character development couldnt hook felt like keep revisit point positive note visuals martial art absolutely spectacular first act film contain martial art crisp wellchoreographed final act flex cgi dollas make already big budget stretch far impressive sight see marvel movie far movie didnt quite hit recommend people see theatre let tack tire go see anyway,Positive
99,marvel do much good lately horrible tv show bad tv show single good movie since captain marvel nothing seemingly good come horizon honest start give marvel produce magnificent movie great entertainment many year lately like magic come seem much run mill basic bore marvel feel marvel try introduce political correctness feminism nonsense diversity fail movie however failure movie simple point follow trope cliche classic hero journey exactly work marvel take classical story hear read see switch thing around keep marvel feel make play mainly china almost chinese actor work imagine sure find political nonsense look hard enough care great fight scene lovely scenery great basic story brilliant well write character even get villain understand sympathise even feel sting ah bad make action movie great stuff marvel point deduct due movie amaze pull hero journey sure also see do better sound great amaze direct great amaze etc etc everything movie high class greatly do well perform top amaze perfect also objection background story end keep spoiler free great movie highly entertain definitely worth ticket price go see get faith marvel restore,Positive
100,let commence say movie far one mostfun action pack marvel movie ever simu liu perfect marvel protagonist awkwafina deliver obligatory yet welcome dose humor youd come expect marvel presentation beyond movie rich mythology adventure incredible martial art combat cannot describe another phrase breathtaking introduction new character story wellwritten feel u start give move deserve marvel trust,Positive
101,,Neutral
102,im someone fan action movie im really even there deny action sequence brilliantly execute lot hit marvel movie although simu liu falter little bite lead man truly impressive cast support awkwafina brilliantly funny quippy always tony leung complex antagonist hero father depth film visual effect beyond beautiful remind ferngully nature observe child good stuff surprise cameo hilarious wholesome good see imax long cinema hiatus definitely check one,Positive
103,muchawaited shangi chi legend ten ring release today theatre follow journey shang chi simu liu son famed mcu villain mandarin revolt father fight evil first standalone film feature asian american superhero shang chi understandably stand close combat sequence actor especially simu liu undergo extensive martial art train show sensational sequence move bus san francisco another bamboo scaffold macau standouts awkwafina surprise return character mcu provide genuine sarcasmlaced comedy add another wonderful layer experience cameo benedict wong ronnie chieng also manage leave audience spit without stoop cultural appropriation allasian crew director destin daniel cretton pay rich tribute chinese heritage every turn hong kongs superstar tony leung michelle yeoh electric role fact dont seem lose step age ace action sequence show dedication performer regard one finest actor chinese cinema every produce tony leung stamp class film give engross captivate performance dread leader ten ring inner moral dilemma lovehate relationship child portray brilliantly man nickname small tiger among five tiger general hong kong cinema flashback sequence help build shang chi character intricately capture upbringing heirapparent genocidal megalomaniac despite want nothing father murderous tendency son inadvertently draw mandarin world violence carnage film delve mystical element towards climax two surpriseladen postcredit sequence tie doctor stranges world mystic art well possible connection ten ring alien technology always way weave individual fim character wonderful tapestry make phase joy due wellwritten character nuanced act performer shang chi stand eyecatching cgi elaborately chorographer action sequence add gloss end product another wonderful new addition mcu world hopefully pave way ethnicity represent universe time go highly recommend must watch marvel phase continue raise bar,Positive
104,disappoint marvel entry black widow shangchi return form movie marvel need bounce back solid performance great setpieces fun action sequence emotional depth humour type film need see big screen go along journey fantastical element also pace well intrigue runtime direction solid character get good amount screen time develop well place flashback sequence martial art fight pretty well do cgi creature look interest design good special effect overall well do didnt think marvel could keep go prove still make great stuff care,Positive
105,like many concern new marvel cinematic universe saga would trouble live previous standard shangchi already leave hopeful series future literally know nothing character find film debut solid superhero adventure well act effectively characterdriven occasionally funny rich cultural representation boom swift stylize martial art action hop go get black panther inclusivity interest world narrative im representation story character must pronounce find entry lot distinguish captivate although shangchi tread familiar origin story formula there fresh twist turn uniquely set character journey apart others though first half decently entertain identifiable drama fastpaced yet slightly derivative setpieces urban environment second half film really turn least chinese philosophy kick mythology abundant there ton visually strike imagery fantastical set load insane action choreography asian representation chain enrapture doesnt feel contrive sense great deal respect engage story unfold nice balance satisfy saw im really look forward see shangchis world itll tie story yettocome cool movie soulful cultural actionpacked,Positive
106,really look forward film excite see shang chi mcu start good interest father son character development film continue seem rely heavily cgi cgi felt bloat overwhelm act well do everyone film weak link hop film would ground plot like iron man,Positive
107,,Neutral
108,action camera work particular along cast impressive didnt like though couple throwaway nuisance character weird humor id say worth watch plus good see old marvel face,Positive
109,wow another marvel film yay im sure watch know ive see least time bore cliche superhero plot cheesy dialogue dull act see special effect im sure disney go figure make good film one like continue rake cash box office well inundate forever thats real shame,Positive
110,twelve year old love movie big bold colourful action pack fun funny fly dragon cranky codger say fly dragon sorry preteen peek highly unlikely fly dragon silly figment someone imagination movie fly dragon difficult take seriously sorry kid also shock news santa clause let save another day good news marvel step plate inclusivity transformation movie make also manage keep rest superhero universe ruin pretty good martial art film insert briefest brief marvel cameo keep important story arc thread usual studio support cast pretty sweet ben kingsley ringo accent absolutely slay ronnie chieng brief outrageous cameo absolutely slay awkwafina major cameo absolutely slay tony leung dark father ring master absolutely slay slay lot bad news let face fact may possible make good martial art movie thing get interest get fight sequence combatant absorb lethal blow magically fly backwards unscathed zero gravity time baby thing use do wire obvious oddly enough even cgi ready still get bizarre old school wire look homage limit lastly sadly rouse cast secondary character pretty well squeeze simu liu main character role kinda forgettable truth tell thats problem big problem really cool highlight shangchi like morph forest maze series disconnect sequence seem parachute integral story often case marvel universe someone art department go little crazy black panther robot rhino bizarre shimmer sequinned horse hybrid hornless unicorn nocorn oh cute furry wing animal get ready xmas plush toy stampede somehow survive without orifice really nothing go nothing go yet survive also communicate shame niggle detail ruin could grand cinematic experience epic epic proportion though relentlessly formulaic family affair nick shakespearian conflict culminate volcanic battle scene archery catapult sword uh oh yeah fly dragon marvel universe make stride especially dark moody black widow hilariously top pottymouthed deadpool shangchi heroic stray away usual mask hero tights genre need le lot le chop chop twelve year old rejoice,Positive
111,,Neutral
112,welcome addition mcu avenger come shangchi kungfus way top tier mcu territory especially come origin story perhaps generation crouch tiger hide dragon visual spectacle behold shangchi full beautiful creature costume martial art act probably best fight mcu make sense though cap winter soldier fight personal favourite real mandarin make debut disappoint tony chiuwai leung fantastic cast member likable well appearance mcu character include surprise one somewhat redeem refresh marvel superhero movie primarily focus ton potential jump right marvel storyline mcu still hold lot excitement future character like shangchi,Positive
113,nearly ten year inception marvel cinematic universe dominate adventure white men scarlett johanssons black widow fight get film year male costars get entire trilogy black panther reinvigorate franchise celebration african culture prove marvel brand didnt beige captain marvel become first mcu film front woman shangchi legend ten ring mark first asianled film film feature first asian protagonist also feature predominantly asian cast crew thankfully give franchise much need change perspective ten ring around nearly thousand year gift wearer wenwu immortality may rule unmatched strength century build empire blood wenwu turn away life violence ying li guardian mystical land ta lo heartbreak strike shortly wenwu pick ring cause go dark path son shangchi run away unite state ten year son must come home confront father become truly mean similar ryan coogler able black panther cowriterdirector destin daniel cretton bring best new world able handle mountain establish exposition use flashback may bite liberal especially film reach climax theyre use meaningfully build upon story focus character culture without lead act credit name simu liu take titular role storm navigate typical hero journey charm composure mix bite tchalla tony stark shangchi hero battle past future liu cretton strike great balance liu hand crettons material somber moment cretton let lius comedic instinct light room veteran tony leung bring melancholic energy wenwu role wong karwai particularly work mood love leung layer villain distance average world dominator carry stillness inspire fear compassion two thing make greatest villain overall narrative within marvel film evenly compose plot action thankfully cretton blend halve together imbue setpieces quality wuxia genre take film ang lee crouch tiger hide dragon also star michelle yeoh zhang yimous house fly dagger action often tell much story dialogue particularly gracefully dazzle open sequence there also room brutality first act end towerscaffolding brawl shangchis emotion turn raw killer since captain america winter soldier action impactful technical emotional level allow film shangchi quite spectacle get forcefully mold marvel film result le stellar even work story action cretton cant break free thirdact visual effect extravaganza hold franchise like iron vice shame smaller familial moment mind soul forgettable litany explosion encompass final thirty minute 25th film franchise ive come expect level disappointment thank multitalented cast crew shangchi legend ten ring one better origin story within marvel cinematic universe action may rightfully sell point heart film lie within character tell familiar story impressive scale,Positive
114,,Neutral
115,good movie even though wife dont usually like genre enjoy one nora lum steal movie look future film prettiest actress film fela chen even though play mother also ook future film,Positive
116,charm movie come set main character show reflection today world asian culture way life west create environment search one identity place meet shangchi simu liu first young adult try navigate life far away family city san francisco partner crime best female friend katy awkwafina simu lius character arc film significant although make solid protagonist character development de minimis awkwafina contrast steal film ordinary person catch epic power struggle trademark zinger bemuse quip make perfect foil escapist superhero world audience thrust mandarin tony leung chiuwai subtly effective marvel villain compel family backstory cinematic antagonist idealism righteous sense purpose since bill butcher gang new york michelle yeoh shangchis aunt jiang nan great fight scene stand wonderful performance crouch tiger hide dragon overall movie great fight scene extraordinary effect especially fly dragon delightful watch highly recommend everyone like superheroes touch mysterious fairytale,Positive
117,always fun go theater new mcu production chance see something new know well produce keep stretch share universe superheros shangchi look like phase well truly launch already glimpse marvel studio overall approach go like black widow marvel run jam bondtype film shangchi try chinese martial art thing result kind compromise westernize version fall two pole sure though youll entertain there enough action lot strikingly beautiful setting fun character forget midcredits scene one best theyve ever do totally worth stay thats quote put title come certain familiar character tell shangchi sure come join craziness usual thing toss baton forward whatever next production stylistically clever really stand film fill runtime whole lot material lot character maybe much third act particular veer onto fantasytype track doesnt entirely fit well previous hour half setup scene last section suddenly feel rush go day first iron man thor antman movie lean linear storyline single well define theme instead marvel seem want overstuff every one production even involve secondary mcu character turn epic bigger always better like cast marvel always impressive job bring good people nice see le major role female oppose male mix match well mostly young cast though think older pair tony leung michelle yeoh really stand effortlessly dominate screen leungs character could stock onedimensional scenerychewing villain he much nuanced simu liu lead role shangchi exactly great actor yet he athletic cute attractive sense humor role doesnt need much awkwafina katy usual turn comic relief side commentary dash romance trevor slattery ben kingsley come nowhere he absolutely place somehow work partly pet rise disney level cuteness phase first three cycle introduce use particular major character require fit avenger umbrella postavengers era schedule series release well see much diverse slate character story dont obviously fall single umbrella master plan something equivalent avenger hard see maybe theyll use new freedom show u interest story bigger universe,Positive
118,,Neutral
119,,Neutral
120,unlogical story plot luckily actor performance fight scene save movie simu liu akwafina great funny tony leung rank top bad guy mcu story rip action choreographer brad allan thank brad allan bring hk jackie chan fight style movie bring back lot memory,Positive
121,marvel back root one perfect film hell lot entertaing black widow far home big surprise film wont spoil yeah watch theater home watch nontheless great film heart soul,Positive
122,usually mcu movie forget soon exit theater one much emotional serious flaw entertain engage,Negative
123,,Neutral
124,cinema fire think partly katy crazy energy also bus fight scene incredible really get thing go funny movie laugh come audience frequently great time good story amaze visuals good comedy nice fight also ten ring action spectacular watch ten ring brutal major world event official start new mcu black widow prequel overall movie probably cinematic experience change game completely major cinematic experience star ðŸŒŸ ten ring ðŸ“€,Positive
125,shangchi character many others know little marvel case offer clean slate tell fresh story im happy say deliver marvel newest out kungfu superhero extravaganza fully build action set piece performance simu liu tony leung stand amongst pack offer great rich story marvel cinematic universe though film time feel bogged origin story trope direction destin daniel cretton overall charm cast story make film feel fresh lively im happy welcome crew ever grow mcu cannot wait see come next hopefully shangchi,Positive
126,crouch tiger hide dragon wax wax fight fight fight title annoyingly long movie exercise hohum perfunctory dot cross t wade shallow water whatever next batch uninspired marvel movie present collective global face become increasingly difficult feel old sense joy inspiration moviegoer use call movie magic maybe everything ohsomagical time crisp bloat minute worth seem almost impossible reveal spoiler movie plot could fit business card print large font something like hero show struggle midway overcome substantial adversity win sequel shangchi become part greater marvel cashcowiverse disney buy intellectual property make type thing feel like work one go show completely acceptable check one brain door movie become absolutely tedious ponderous even ponderous,Positive
127,top greatest marvel movie ever make choreography fight beautiful cgi beautiful story beautiful watch,Positive
128,yet another film appreciate actually like im really glad movie exist diverse character mcu film nail shangchi simu liu give great performance motivation isnt exactly clear character like good see origin movie great job give u somewhat compel character look forward see however character arent anywhere close good performance everyone good tony leung give great performance villain isnt great character wise really adore villain motivation finally get true villain motivate grief inability accept loss love one love refresh see story weak didnt engage much hard understand motivation anyone except villain plot progress quickly hard remember individual story beat kinda meld mcu film one thing stand visuals action sequence action sequence great like final battle others felt lackluster mix bag regard always visuals film great part occasional weird visual effect doesnt get absolutely horrible production design surprisingly great set look really cool obvious spend lot time really isnt lot say one hand lot great thing feel like standard marvel movie would recommend check still mcu,Positive
129,another amaze marvel film awesome visual effect think great job blend asian culture within film give secondtier marvel character,Positive
130,effectively origin story shangchi marry style superhero martial art film wonderfully add much need intrigue back marvel cinematic universe mcu legitimately enjoy movie try new thing one enjoyable mcu film however quote tip scale become one best mcu movie opinion time felt little fantastical like especially third act story visuals character pretty great find film mostly suffer end could ground reality happy though see shangchi add mcu,Positive
131,first question ask would movie even make first place one one try much ultimately fail everything start love story turn filthy rich asian end conventional action pic romantic feminist vibe terribly present throughout entire picture wouldnt bad movie trouble settle one single narrative almost like asian version rocky horror picture show typical current generation filmmaking another people run around thing movie market saturate sfx garbage movie summer full,Negative
132,,Neutral
133,mulan remake safe say thoroughly disappoint portrayal chinese culture even mystical sense felt like disaster one oh one much better actually impress felt like actually cater different market time someone unfamiliar chinese culture may find another marvel moviealbeit amaze one know treat something basically non existent hollywood film aka inside jokesdepth knowledge really help elevate film whole nother level,Positive
134,,Neutral
135,yeah really enjoyable film anything unique incrediblekind action definitely action far greatest part movie damn look sick choreography excellent fight fluid fast pace carry momentum throughout due vfx ofc good high budget film think movie mess bite villain villain isnt bad per say really bland unoriginal actually get really predictable towards end also end absolutely crazy dont get wrong crazy absolutely great top movie like take movie first section movie tho amaze middle chunkmeh final mehwowmeh soundtrack good side character stale comedy actually surprisingly good sometimes misplace serious scene thats ititsits good,Positive
136,usual marvel origin movie would predictable story check sarcastic tone awesome punchlinescheck end hype next moviecheck check necessary box top martial art awesome fast pace plot cgi pack stun visuals awesome score post credit like cherry top coolest marvel superhero origin yet,Positive
