,Review,Analysis
232,movie biggest strength action well choreograph well capture camera unlike movie ive see aside character solid give depth family dynamic heart story fumble third act feel like contrast lot try set order top fantastical element show overall enjoyable probably appeal marvel movie since black panther,Positive
233,much potential get sadly waste fight scene first half better quality compare usual marvel quick cut edit one mildly reminiscent matrix fight intro shangchi theme music even sound suspiciously similar furious angel matrix reload make miss matrix film however anything positive film end first half second half culminate bloat cgi mess hallmark almost marvel movie fact shangchi black widow id say latter feature much better visual effect would look better big screen shangchi would apt direct video release didnt also help lead actor complete void charisma honestly go watch jackie chan movie help deal kung fu crave movie initiate fail deliver,Positive
234,gonna lie fewer expectation since marvel studio thing turn lot better expect action sequence martial art enjoyable jawdropping cinematography camera work edit bgm impressive performance though much exceptional storyline keep invest throughout highly recommend great reason get back theatre â¤,Positive
235,,Neutral
236,disney marvel get point collaboration much project together seem look feel exactly every time new movie marvel cinematic universe come seem like filmmaker prove project another superhero movie luckily mcus newest offer shangchi legend ten ring stand quality action film best stuntwork visual effect year movie perfect contain trite superhero storytelling element disney movie often rely directorwriter destin daniel crettons clear talent behind camera transform every average scene largerthanlife sequence high stake character easy invest first act film admittedly play similar many mainstream hero journey tale average joe shangchi turn morethanaverage call must return past order keep father evil thing might cause many innocent casualty seem like combination idea do movie weakest set interest concept plot shangchi gold execution storyline firstly character interest start movie end despite clichÃ©s audience still care happen every character include fantastic villain comedic relief also point throughout character feel personable colorful due life actor put performance simi liu shangchi star make similar chris evans turn first captain america film cast director hollywood likely near top call list performance film however tony leung shangchis father primary villain leung play one livedin memorable mcu villain since erik killmonger impossible feel sympathy even though clear serious issue deal inner demon end day believe shangchi truly remember technical mastery put action sequence time tell statement remain true strike watch film contain wellfilmed action sequence liveaction marvel movie thus far highstakes fight scene bus minute movie make realize filmmaker werent mess around action stunt choreography phenomenal visual effect cinematography stun action set piece inventive pay homage great asian cinema past final minute shangchi involve one large final battle rank one favorite final fight scene mcu along avenger endgame infinity war shangchi legend ten ring perfect especially look complete reinvention mean superhero movie adhere many standard already set genre stylish sleek way difficult smile much film cretton fantastic job helm movie way set apart project come end craft avatar last airbender movie wish superhero movie may run idea continue craft well expect see plenty come b,Positive
237,shangchi legend seven ring tell story young man name xu shangchi confront past confront organization run dad xu wenwu obtain ten ring wenwu give immortality power overthrow government different time fall love woman village magical forest shangchis mom death wenwu want find way revive village shangchi sister need stop army cause destruction soon saw trailer know shangchi film see everything film right alley martial art dragon strange creature cool visuals magic fact marvel film really cross mind look like perfect kind movie see big screen stack marvel film story shangchi pretty typical come adventure film like make work focus build character throughout film give right balance action development film also help le humor marvel film take much seriously origin story shangchi say comedic moment really funny perfectly time part clever pace pretty solid fast slow worldbuilding vast think would creature power weapon magic everywhere well magical forest fit nicely story complaint story xialing could use development screen time le main character really want know build underground fight ring overall story good performance great elevate character tell excite simu liu movie show passion every scene great dialogue reaction great fighter perfect role come natural protagonist want reunite family right thing shangchi also good character learn good fighter without ring point invincible movie also awkwafina katy fun addition add lighthearted scene rather dark film still part action get serious need menger zhang xialing quite good well come incredibly powerful command every scene backstory pretty tragic father treat really want see future mcu project run underground fight club one interest part movie tony leung shangchis father also villain still think kilmonger vulture best mcu villain xu wenwu make great villain one villain definitely need stop root protagonist also stop sympathize legitimately love family start become destructive tragedy family also help think bring family together actually tear apart add extra element sympathy tragedy character leungs performance make wenwus character human actually root turn good end film make leader ten ring normal father raise kid wife moment show important give villain depth motivation background wenwu make one better mcu villain visuals movie insane easily best look marvel film long shoot stun inventive cinematography well great special effect really get excite awesome action scene film plenty martial art fight great stunt work camerawork make fun watch power seven ring look really cool make fight even fun watch climax come give want say much one excite fight mcu movie also incredibly memorable catchy musical theme easily best score marvel film shangchi legend seven ring really good think even people like marvel would get film best visuals action marvel film also really good story likable relatable character usual marvel film stay credit,Positive
238,bite draw lot flashback whats ring there never backstory nice fight scene like creature end,Positive
239,actually enjoy movie didnt hate love many slow part personal like extremely hype see get start amazingly get begin middle middle middle movie many dryslow part point lucky thats hit dragon eye mandarin save point enough give little energy stay doze lmao actually love layer father seem story story lose wife actually reason show matter much battle conquer destroy take love powerful even powerful individual weak come love easily manipulate come love dislike father first see reason behind actually hurt want wife bad point thing refuse see want bad actually outshine son backstory end movie definitely save movie action enough action lot action movie seem slightly rush area end credit mmm blunt first end credit last last end credit first love empowerment woman do better touch culture well daughter son one look love make effort touch urban culture well music buuuuut lil overkill part give take around middle little much slowdry part much enough action wouldnt pay money go back look buy come 4k sale couldnt get like want would say go see amaze movie,Positive
240,,Neutral
241,everything movie amaze havent watch watch problem didnt really use many character hype death dealer abomination,Positive
242,love shangchi amaze marvel superhero asian movie ten ring reference show iron man marvel one shoot antman mandiri character amaze previously iron man visual fight awesome also include abomination wong rat,Positive
243,good time watch movie think little slow time create pace issue wasnt anything bad think thing couldve do better overall movie enjoyable watch,Positive
244,enjoyable addition marvel franchise lead actor excellent storyline pick pace particularly like u action sequence sequel look prim,Positive
245,unbelievably unbelievable marvel go top chinese culture fantasy myth even tho much even asian community nevertheless appreciate absorb fight scene visually stun choreography exceptional fantastic vfx sfx cgi see detail imax issue execution good dragon raya last dragon mean disney mcu vibe also wish didnt watch many trailer movie cuz lose surprise post credit tho fun insane,Positive
246,test anyone praise movie either intelligence year old complete slappie shill movie isnt offensively bad play like write child silly shallow far cry epic marvel,Negative
247,big screen mini review view sept katy thats fine explain plane say shaun aka shangchi mark sudden unexpected twist event many upside crouch tiger hide marvel gosh even startâ“ ang lee circa quasimystical martial art spectacular first film come mind whilst watch certain beautifully atmospheric segment openingact shangchi legend ten ring shang chi short youll know immediately upon see feature everamazing malaysian mega star michelle yeoh course one principal character crouch tiger hide dragon well fyi mean intend spoiler several movie official teaser trailer gallantly feature say scene albeit briefly whats trailer also youre someone even slightest bite true passion thing within realm sheer cinematic fantasy ðŸŒ  youll absolutely delight know shang chi also distinct harry potter aspect even thats enough get get fullblown dollop narnia throw good measure really honest felt bite disorient first see type element mcu marvel cinematic universe picture suddenly realize infinity war endgame prominently feature well walk talk demolition derby err raccoon begin feel home pretty darn quick one stark downside ala mcu way much muddle obfuscatory message visavis ten ring year 2008s superbly receive completely iconic ironman introduce bespeak militant organization ttr short first time explicit unequivocal reference film initial set sometime within usa long war afghanistan official state religion islam hence extension ðŸ’¡ correspondingly glare although tad implicit suggestion ttr immediately apparent ethnic background mostly urdu arabic speak member portray group visually distinctive flag right undeniably frighten imminentbeheading type video feature thoroughly bruise bloody tony stark centerpiece reminiscent horribly tragic bloodcurdling news story weve sadly accustom read hear watch year yet another archetypal classic islamistfundamentalist type group fact strongly convey u particular picture begin way trailer simply case say militant group course turn core way originsstory arab middle eastern fact chinese certainly confuse especially majority u havent read mandarin v shangchi comic go figure ðŸ¤·â€â™‚ï¸ ðŸ¤” final analysis get basically overlook aforementioned legitimate inconsistency pertain marvel cinematic representation ten ring organization yes part least believe rave review utter delight movie already garner globally huge shoutout rookie relatively speak director destin daniel cretton who able achieve feat get 5th directorialventure ever ðŸ‘ start humble yet impassioned little comic book effort magical phenomenally empower alien makluan ring trulylegendary stan lee heck feb tale suspense no50 become supremely enthral fresh new face marvel bold new era start phase four film star newcomer simu liu whose portrayal outwardly nerdyseeming yet immensely likeable shaun work wonderfully mention super ðŸ˜‰ impressive kung fu skill course everjocular best companion katy awkwafina show absolute ton heart courage fierce loyalty throughout tony leung menger zhang fala chen michelle yeoh course shangchis big fun opensurprise one ben kingsley perform respective role panache tell go completely charm fiery mark rock marvel ðŸ‘Š ðŸ”¥â—,Positive
248,bad great kinda like spiderman movie really action pack story ok one win oscar act write kinda mock ridiculous story end cool tho actor didnt really sell cgi really excellent cgi nobody ever look like actual danger fact everyone dangerous scene look pretty clearly like act concern demand like background extra fun watch couldve wait tv honestly,Positive
249,,Neutral
250,im super happy say marvel newest movie out shangchi legend ten ring hilarious action pack cgi thrill ride fantastic one see black widow worry marveldisney start shift focus ambitious tv mini series project leave quality movie behind im confident isnt case set visuals costume choreography score act direct top notch shoot feel fresh visually stun joke emotion land action amaze first big set piece involve shangchi simu liu best friend awkwafina bus ride work go horribly wrong hook instantly either awe incredible fight choreography laugh perfectly time joke really doesnt let either category go forward cant believe much love pair character choice make romantic love different real feel character mcu often marvel problem reliance personality trait hero funny jerk confidence bumble idiot thrust power main character naturally good person he comfortable best friend power come accept never truly stop doesnt learn lesson roll punch almost go actor simu liu bring extra dose likability role along chemistry share awkwafina make friendship believable there even great reference cameo credit scene fan look course problem biggest big cgi slug fest end plague type film truly need smaller mess cgi time feel little big rush character instantly know understand thing accept everything ease easy look much fun youll,Positive
251,movie start finish pure entertainment disappoint beautiful choreography visually stun end wow like dance visual effect almost mindnumbingly beautiful like trance hat everyone involve pure entertainment,Positive
252,shangchi legend ten ring new installment marvel cinematic universe star simu liu first lead role sling akwafina michelle yeoh great tony leung ricky gervais say clearly actor nowadays adventure fantasy nonsense job isnt act go gym take steroid shangchi nothing adventure fantasy nonsense feature ridiculous scene mcu awkward greenscreen scene simu liu shangchi rivalry father tony leung actor dont bad job dont really feel character shangchi tony leung master act shame dont get dramatic scene awkwafina ben kingsleys character comic relief character every marvel movie need apparently major brag point mcu movie dont feel like mcu film ridiculous moment like shangchi doesnt always work well,Negative
253,,Neutral
254,definitely go freak beautiful,Positive
255,low expectation one movie prove wrong movie exceed expectation aspect get great hearttouching story funny moment lot funny scene hear people laugh love awkwafina funny beautiful time become fan movie great costume moral story etc personal opinion think mc kinda flat personality cant really sympathy sidekick story interest background personality ex katy little sisterxiangling father mc downside really disappoint final battle overuse cgi cgi look like cheap budget movie best fight scene fight bus,Positive
256,good action great visuals slow story weak villian,Positive
257,amaze favorite marvel movie far great choreography act perfect cast non stop fun,Positive
258,marvel lot right good fight scene one movie battle character available context new world story despite classic somewhat cliche story bring lot joy classic classic reason right cliche powerful right light also post credit scene yes marvelllllll,Positive
259,chinese person live australia watch shang chi uncomfortable experience unexpectedly resort tire trope king fumartial art eastern mysticism chinese culture unlike black panther envision futuristic african kingdom shang chi would place 15thcentury china exasperatingly unimaginative reductive apply treatment white hero marvel universe would watch either western bunch heroesvillains supremely adept colonize new territory subjugate local populace steal wealth instead diversity inclusivity might intend feel like opportunismtokenism disguise benevolence disney better,Positive
260,good film blend genre nicely one part martial art one part family drama one part fantasy one thing mcu good tell story different genre make fit within universe film exactly best fight sequence within mcu dynamic shang chi awkwafinas character nice dynamic two really play character play part story none really feel push side villain also one better one mcu conflict value see good bad side also isnt predictable see go next finally director feel like give lot freedom usual inside mcu film story tell hasnt many film tell sort style tackle sort issue movie feel like significant film mcu move forward mcu one issue black widow overall deliver everything want mcu film plus new stuff enjoy mix humour make laugh find funny lot force mcu humour one people tire quick one liner mcu movie go frustrate bad one biggest problem mcu template sense joke massive cgi battle end tie mcu different way humour work moment others fell force overall thought overall shang chi excite mix mcu martial art family genre fantasy love martial art aspect tell mcu formula try cheapen experience little bite however put together get yet another mcu film know whats come next yet quite top teir mcu movie overall im go give shang chi,Positive
261,first thing jump uneven act compare usual marvel movie actor alternate overact pathos subdue attempt coolness add usual marvel style selfreferential wink wink humor obligatory minute cgi showdown purple light theme villain monster 15th time end jar nauseate tonal mess movie movie exact story beat pace style soundtrack joke trashy special effect lade battle end try gimmick thing kung fu thats apparently disney think people want see movie asian cast youve see dozen time better martial art fight public transport do death recently quite well nobody also marvel film like captain marvel general fight pale movie like matrix john wick jackie chan classic reality marvel movie feel date play nowhere go except one cgi battle next maybe marvel would better switch series format movie reheat microwave dinner point save money something original,Positive
262,film great overrall story know way tell engage emotional first thing love movie action sequence every action scene damn good soundtrack amaze character well write even smaller role kinda memorable vfx great high standard final climax messy notable two credit scene dont miss mean doentertainment cant wait mcu movie,Positive
263,ill brief clearly much effort think fund go flick go show one assemble right ingredient recipe still make meal good action live action cg stale transition always evident solid storyline pad average good actor support role movie know hero ultimately triumph get journey underwhelming,Positive
264,shangchi definitely marvel best film marvel orgin story welcome likeable character mcu good action amaze beautiful choreography edit flawless shoot excellently simu liu awkwafina present likeable character world build decent villain could flesh story wasnt greatest act wasthere overall would say story start great slowly crawl way finish line good movie marvel best,Positive
265,shangchi legend ten ring call asian black panther think inaccurate description two reason first asian culture explore indepth hollywood since 1970s latest way subsaharan african culture second point shangchi really mashup two hollywood subgenres around quite time ethnic discovery film stupid american tourist film ethnic discovery film recent type far interest ultimately inspire alex haley famous tv miniseries root document saga protagonist learn relearn heritage embark quest fully embrace heritage good example think thunderheart fbi agent val kilmer come appreciate father native american ancestry case lakota reservation famous fantasybased example star war luke skywalker learn jedi blood surface shangchi definitely follow pattern unfortunately movie ethnic discovery theme undercut clichÃ©s even older hollywood storyline one film historian dub racial adventure film simply call stupid american tourist film common since 1930s film plot follow western almost always white character visit exotic foreign land often purely exploitative purpose proceed reveal ignorance native culture always demean colonize indigenous people since former force make buffoon latter must bear humiliation take seriously shangchi ethnic rediscovery film two chineseamericans san francisco learn one case relearn culture ancestor also racial adventure film essentially westerner travel china find midst culture clash white case titular character immigrant shangchi girlfriend otherwise fit role stupid american tourist unmistakably american accent annoy use slang pointless popculture reference wisecrack sarcasm twist like kilmer thunderheart revert noble savage origin travel ethnic place go native incidentally there one way shangchi legend ten ring differ dramatically black panther base nonwestern comic book saga create white men black panther turn stereotype black african completely insideout give u fantastic science fiction instead hackneyed jungle adventure shangchi usual kung pow hash orient present ironically also way isnt terribly original fact there another marvel movie one closely resemble black panther deadpool combine wacky humor serious even dark subject matter way thats jar ultimately exasperate least deadpool felt fresh,Negative
266,excellent cast story fine joke funny action well film could see actually happen snake eye take note much better black widow,Positive
267,visually beautifulgood action sequence great starcast ruin experience expectation go one read extremely positive review around like suicide squad even one average flick nothing else later turn average movie neither bad good,Positive
268,,Neutral
269,tony fala simu absolutely phenomenal performance fantastic movie nice see representation different culture movie asian community black panther african american community action scene one best marvel movie choreography far best marvel movie movie felt like ip man mythical story add action impeccable story unique wasnt generic love simu stunt marvel never cease amaze need company like cough cough warner bros sony cough cough thankful get two,Positive
270,great start especially fight choreography shang chi parent sheer awesome fight bus get good humour bonus story get drag turn weird instead take u shang chi universe martial art dr stranges dark door soulconsuming monster another realm like borrow element hell expect much,Positive
271,starter cinematography cgi pretty nice however thats positive end fight choreography ok bad great example even mortal combat way better way le also follow usual marvel formula lot cgi fight scene time blow roof make scene feel completely detach world theyre concern character shangchi isnt really part movie take step back movie lot thing character time spotlight do reason thing cause neglect movie basically background character female lead one plain annoy really serve purposeyoull know instantly appear overthetop strong woman actually get screentime dont get wrong actress act nicely way present story way character come establish unnatural feel like shes someone activate irlcheats feel like take real shortcut character whilst much couldve do make really likeable immersable viewer however way handle make feel like 2d cardboard character use cheat max stats story dialogue story abyssmal really lack content feel like something hungover student would drum lastminute late night party dialogue feel wooden time really unnatural dont even get start humor overly force really bad feel like movie know want want go dozen way leave much clutter sidestep feel like coherent story choose thing stick could decent flick,Positive
272,actor action film disappoint know tony chiuwai leung michelle yeoh go good simu liu awkwafina fantastic keep traditional also add little modern flare kungfu movie must see movie theatre sit couch,Positive
273,freakin blast story complex interest fill gap mcu simultaneously great origin story character shangchi whole cast amaze mean much chemistry simu liu tony leung phenomenal respective role mandarin thoso well create character movie amaze bridge east west culture much explore much like wakanda history shang culture rich fight choreography absolute kick guttsin good way mean something completely new mcu deliver everything look goddamn good cant help think scene also color effect camera work etc everything magnificent humor sure also emotional impact bland action pack movie make heart fan fan kudos director destin cretton killer soundtrack main song movie run fit good surprise hide promos trailer manjust wait see credit scenesthey two good one issick sure deserve one view cinema much story build detail action fun people underestimate movie surprise great,Positive
274,absolutely love must watch non stop action imagine good movie say watch film disappoint think go cinema least one time watch great simply buzz,Positive
275,although find backstory unnecessary shang chi fun action pack adventure welcome marvel newcomer simu liu awkwafina make great team look forward see future adventure,Positive
276,,Neutral
277,,Neutral
