,Review,Analysis
344,think mcu pull everything closet movie everything amaze special effect good edit deserve character development intrigue plot movie solid blockbuster aesthetically please bad thing point movie enough end felt like drag best mcu origin story far,Positive
345,disclaimer watch spanish dub version film therefore unable provide criticism original actor act film shangchi hit one favorite marvel film sure indeed take place mcu doesnt feel like marvel film good way protagonist real superpower cheesy outlandish fictional element characteristic many marvel film exchange mystical creative element another reviewer put almost film belong harry potter universe mcu story revolve around shaun simu liu friend katy awkwafina two young valet driver live san francisco rather exhilarate episode bus work group men steal shauns jade pendant decide visit sister xialing menger zhang china warn theyll go next katy insist join plane ride shaun reveal true identity back story shangchi great martial art warrior china whose father xu wenwu brilliantly cast tony chiuwai leung posse titular legendary ring actually like bracelet ask give godlike power immortality wrap around forearm glow bright blue seem mystical magnetic property ever since shangchi sister mother li fala chen die child father right head develop obsession bracelet one day start hear believe wife voice call thus set reunite secret city ta lo hometown hard get hero must stop open pandora box visuals film spectacular especially creative use bright contrast color whats really neat film first half portray modern chinese culture second half portray traditional chinese culture get best world expert chinese culture mean film make way believe respect film also make use mandarin language time time particularly flashback give sense authenticity chinese character speak english time slight criticism avenger endgame extremely cheesy cringeworthy scene near end female character show side side black character show side side etc rather random appearance character wong movie le extension scene kevin feige perhaps director destin daniel cretton say oh new shangchi movie feature mostly asian cast let throw wong dr strange he asian realistic show character different race work together send better message well way black panther feature mostly black cast marvel want make previous exclusion asian character cram many one movie see future store shangchi character color mcu overall really cant complain much film special effect particular blast sound effect attribute ring top cgi general stellar set costume fun fresh fight scene particular great presence character katy bite clichÃ© superhero genre felt lot like equivalent peter parker friend ned tom holland spiderman movie really serve purpose protagonist best friend capable thing otherwise wouldnt capable sake plot would cool shangchi instead senseilike teacher guide case liam nessons raz al ghul batman begin guess role play dad flashback scene isnt really origin story also would like see shangchis sister doesnt get nearly much screen time character development humor fell flat say disclaimer watch spanish dub version maybe actually funnier original english conclusion shangchi exceed expectation likely watch near future,Positive
346,,Neutral
347,there way people movie near perfect best marvel movie cmon epic plot bad definitely epic fight scene setting moment,Positive
348,love classic spirit bring back also kudos bring kungfu hustle icon board mega fufest deserve rewatch many year since joy luck club piece make heart surely,Positive
349,clever story amaze martial art interest backdrop enjoy appreciate english subtitle clear read onscreen longer movie subtitle martial art exhilarate love cgi colorful creative film win multiple oscar award movie entertain must see,Positive
350,shangchi legend ten ring absolutely list favorite marvel movie full hype film ultimately leave disappoint one live every bite hype action begin end best ive see marvel movie general long time choreography especially perform michelle yeoh menger zhang fala chen stunt double felt like poetry motion everything do much grace elegance want end simu liu bring charisma charm shangchi deliver amaze action sequence nothing short fit role surprise awkwafina unbearable assume would movie lose momentum 3rd act slow bite take deeper dive story quickly pick back head final battle set cgi use create breathtaking shot add greatness film marvel fan film worth go see,Positive
351,one best marvel movie ive ever see expect good exceed expectation far beyond definitely recommend,Positive
352,havent much marvel guy even biggest event film shang chi solid story move quick lot great character almost nonstop action scene finale hide trailer definitely way think id prop team one,Positive
353,impress narrative film predictable amaze fight choreography sometimes action sequence blurry complaint great cast color grade pretty good,Positive
354,deserve top marvel movie ever make really go see sheer perfection make ear ear action fabulous visuals breathtaking,Positive
355,beautiful breathtaking experience imax marvel do disappoint john wick level martial art scene fantasy action dont want miss,Positive
356,one favourite marvel origin film storyline visuals cast fight stunt scene amaze fact id say beautiful respectfully make simu perfect shangchi sorry doubt cast keep think jung kims convenience good show,Positive
357,im gonna lie movie didnt impress much base trailer still want see well marvel movie fine believe would good story opinion wasnt good usually marvel marvel masterful storyline wasnt good opinion movie come studio past good hand music place without doubt best marvel always able probably always able action action scene awesome although frequent time pace slow wait fight though youre epic cgi load fight devour there still occasional quirk throw usually case marvel movie sum good movie recommend classically marvel fan,Positive
358,something feel new movie like beautiful vfx quite marvel cinematic universe film vfxs film actor great job especially hero dope movie mainly stunt felt quite realestic become watch lately awesome,Positive
359,fun ride emotionally touch scene tony leung chiuwai work hard make character different kind villain stereotypical way lose connection wallow grief deep see cause act simu liu carry movie alongside tony leung get lot fatherson conflict touch see screen fight scene really good action top notch like friendship run along story stay two end scene tease much,Positive
360,intent purpose movie typical dc movie marvel film thats every bite insult intend overthetop praise effort generate either bear pure loyal slappies people wish seem culturally progressive praise ridiculously shallow cotton candy movie every character superficial lead charisma wet bread story basic never give viewer chance connect character even motivation tone jump everywhere director hand jigsaw puzzle worth scene ask string together frame cgi madness honestly completely silly overthetop open bus brawl insane cgi third act dragon fight dont remember ever roll eye much marvel studio endeavor well maybe third act black widow make realize far phase four wander away make mcu great visually stun scene overall good idea play everything fall sort kiddy cartoon category nothing consequence either physically emotionally,Positive
361,,Neutral
362,watch movie avid marvel fan film introduce new character standard disney approach mix comedy seriousness lot action disney work number film surprise tin act good special effect solid story bad there continuity link marvel universe nice fan would actually pitch quite higher review ten way mark film bad,Positive
363,good act movie cinematography visual effect certainly well choreograph action martial art scene however story line somewhat lack also try hand comic moment dont cut mustard im manage couple small giggle along fellow cinema go compatriot,Positive
364,shangchi worth wait hype immediately fell love character charm charisma screen fight scene well choreograph film felt like front row seat artistic beautiful fight sequence screen mcu history character development also astound cannot wait see go work art movie cast perfect well direct music must see mcu superhero fan alike,Positive
365,talented brilliant incredible amaze show stop spectacular,Positive
366,every time hear marvel open theater get chill happy saw film theater shangchi legend ten ring kick new wave mcu excite journey lie ahead great character narrative score action overall totally worth watch make sure stay midafter credit scene,Positive
367,expect superhero movie get child disney flick good anyone otherwise pretty bland bore cheesy look like marvel finally lose touch like disney new star war like otherwise dont bother,Positive
368,great movie one favourite mcu movie behind thor ragnarok guardian galaxy volume one amaze cast fresh story world cgi highly suggest see theatre full experience loss one star asian martial art movie doesnt entirely live great come crouch tiger hero etc say close though praise enough excite group part mcu excite see,Positive
369,movie highly anticipate hold expectation massive marvel fan movie fully engage start finish fight sequence amaze different movie make unique every actor give wonderful performance well im rat one dragon sequence towards end awesome start seem drag bite long still entertain though even youre marvel fan still highly recommend see film dont need much marvel background see one obviously youre marvel fan sure piece thing together overall shangchi stun film,Positive
370,,Neutral
371,movie good fight sick action point say first half movie better 2nd overall fun action movie couple dumb part enjoyable like,Positive
372,best marvel movie yet chicken love movie hope see another one different rest,Positive
373,best marvel movie yet chicken pig love movie hope see another one different rest,Positive
374,enjoy see asian culture mix american culture especially marvel movie enjoyable mention different creative,Positive
375,stupid every level fight entertain would rather watch bad 70 chop socky movie poorly write ludicrous story several character unrelateable make wonder writer director actor ever meet another person worth time write review except somehow get moment cannot real imdb embarrass shill mess,Negative
376,kind bore film premise interest kind comedic little compromise convince mean marvel film requirement suspension disbelief default film kind explain little character interaction shallow meaningful end predictable everything look artificial perhaps vaccinate marvel place magic point everything look familiar bore flat perhaps film great big problem film bus sequence start eeps go downhill mean make turn bus keep go time turn leave twice go uphill instead downhill decelerate turn side come standstill clever guy,Positive
377,,Neutral
378,way marvel fanboysmarvel one worst fan base toxic childish praise cgi crap pure comedy story trash joke know already cheesy cringi lame bcz marvel movie course praise doesnt matter marvel make movie dog bark two hour toxic fan base still say movie masterpiece star entertain action scene lady annoy asf really dare say suicide squad marvel clown jam gunn better full cgi trash opinion like watch cartoon stupidalmost fight scene enjoyment marvel incels,Negative
379,pleasantly surprise thing plot simple thus mostly free unignorable hole integration chinese element quite well do reasonable development character include bad guy mostly well orchestrate fight sequence quite enjoyable actually felt like jackie chan time movie good tempo action story development feel place many typical silly wisecrack still quite ridiculous movie therere stuff one pick like girlfriend sidekick felt bite place development bite abrupt plot simple typical etc none prevent movie quite enjoyable experience,Positive
380,excite movie anyways read comic even hype saw reaction movie properly release watch yes moment good amaze people say currently stand imdb really mid 7 like keep mind yes good hole write,Positive
381,really like movie start go certain direction like first hour point movie suddenly become lot mystical decide sway direction harm good movie opinion end want watch cool look well choreograph handtohand fight scene get character kamehamehaing gigantic beast fight along guess cant complain know go get since mcu movie,Positive
382,never fan shangchi comic book movie refresh amaze great introduction shangchi simu liu perfectly well cast great chemistry lead fight choreography best ive ever see marvel great story line action especially comedy love awkwafina cant give star give star rat highly recommend watch wont disappoint,Positive
383,well do great write direct act beautiful choreography cinematography love costume,Positive
384,know nothing comic book character curious martial art character fit avenger universe trailer didnt make excite see movie know much show preview amaze content lot surprise character choreography style substance action emotion film make complexity family love core thats make shangchi rivet story villain bad guy motive love power despite advantage ten ring give current life transform one better indomitable enemy grief come life yes origin story doesnt feel like typical mcu formula relieve shangchi doesnt go train he already train enemy isnt popup fight sake father conjure conflict fight try love add sibling complexity give movie layer emotional stake pretty raw throughout huge third act wish father would love way try desperately sober long rid grief make ballstowall fantasy thats exponentially unleash movie marvel test bravery wisely leverage gorgeous art culture china fight choreograph like dance captivate rich calm soundtrack play sensually throughout ramp grand fantasy third act shangchi flaw find act character story soundtrack script setting none weak shangchi best solo marvel character film since winter soldier may surpass,Positive
385,movie make black widow look like oscar win screenplay story soooo bad there way much raw exposition past event feel like half movie spend recount past stale narrative exposition much backstory need youre try pack much single film character motivation unclear shang chi behavior inexplicable time sidekick behavior similarly confuse movie open two low pay job yet somehow jetset world traveler drop hat shang continually put friend lifethreatening danger movie weaken fan service callback iron man make zero sense cast ben kingsley comedic relief nothing story movie break mcus continuity overarch story introduce new dimension race power without regard exist storyline cameo dont help kingsleys trevor slattery feel year late previous story arc iron man hail king negate andor ignore wong use comic relief doesnt help much there nothing fresh movie disney try cash inferior product,Negative
386,,Neutral
387,start shang chi film worth go see youre marvel fan itll film youll enjoy story link wider mcu action comedy visuals take look review get idea v good mcu film slightly different others weve see think add thing mention review strike watch slow motion musicsound slow mo something ive notice chinese cinema past decade use slow mo try poignant emotional overdo especially slightly cheesey background music labour point shangchi lean heavily several time find roll eye admittedly may notice b cgi think wasnt great particularly start forest fight bus scene get better though overall climactic fight well render little disorientate c eastern mystical stuff try shoehorn couple thing honestly kinda like impression westerner would eastern history culture remind little bite marvel ancient one caucasian lady asian clothe way danny rand try spout mystical phrase iron fist tony leung michelle yeoh yuen wah three major player chinese cinema go way back 80 think great see particularly tony leung expressive eye film know weird thing say yuen wah classmate jackie chan would like see latter honest would recommend check jackie sammo hang yuan biao youtube e fight scene overall good particularly hand hand bus cgi one sharp aggressive brilliantly choreograph one forest though one overdo chinese cinema eye roller ie relationship develop result fight f humour great imo delivery great overall like say worth see youll probably enjoy girlfriend who watch whole lot asian cinema ive see fair share shaw brother film modern day somethings grate enjoy though overall yes,Positive
388,visually stimulate begin end funny smart befit marvel canon excellent film thats fun whole family true must see,Positive
389,famed youtuber ryan george would put wow x4 simply amaze movie spectacular production value thoroughly entertain throughout duration think people definitely one best marvel movie oh definitely stick around mid postcredit scene totally worth,Positive
390,well brilliant way start next phase honestly marvel never fail impress visually stun really good movie fun add little comedy likeable character good actor fun entertain great watch,Positive
391,journey self doubt traumatize person confident saviour world add loyal character always believe protagonist ability humour marvel good old formula solo origin movie marvel perfect formula work fun watch simu lius shangchi grow worthy hero posse legendary ten ring tony chiuwai leungs wen wu easily dominate screen presence leave last impression viewer ageless michelle yeoh part well awkwafina isthere besides captain america winter soldier movie best hand hand combat scene whole mcu mid credit scene surprise marvel fan dont miss movie bore doesnt take risk doesnt venture unique bold story tell like gotg infinity war endgame watch trailer movie pretty much know whats gonna happen spend min movie overall shangchi worthy addition mcu say mcm ðŸ˜‰ decent movie visit theatre two long year,Positive
392,fun enjoyable rule number good film flaw dont care good time bring many possibility large universe madness,Positive
393,give automatic every marvel movie bore idiotic propaganda single handedly ruin film industry well single handedly propaganda thats many movie single handedly make use much anticipate original movie come twice year another bargain bin film movie paint number rehash absolutely despise movie comic book anyone fanboys person even like speak lot dull bore moron mentally stunt intellectually void day marvel universe die great day hope come soon,Positive
394,starve marvel movie fiasco black widow think many rat movie higher deserve run time 2hr min felt like half hr awkwafina mean comedic sidekick completely place skill set could speak chinese particularly funny like pace particularly numerous flashback past instead attempt subvert expectation spring surprise audience relate character character would work better linear timeline doc ock show evil box flashback explain way finally felt cinematically see similarity movie martial art movie release early 2000s hero forbid kingdom specifically fight scene,Negative
395,,Neutral
396,first fantastic right best mcu fear action would follow suit previous marvel film nothing quick cut shaky cam doesnt brilliant cast fantastic tony leung high point point film easy unfortunately second half isnt tight story become little fantastical end god awful cgi mess become common mcu bring score shame first half generally fantastic dont see rush see,Positive
397,excellent marvel movie teach u history shangchi fight scene grand story fascinate scene divine short magical film,Positive
398,class iron man gotg black panther top mcu origin film film extremely fun offer different type mcu film would put film first dr strange antman movie perhaps right level first captain america black widow film ironman gotg black panther thor spiderman homecoming better plot shangchi offer ton heart fight scene amazingly do climax film actually visually beautiful review say cgi heavy actually felt right compare recent asian lead cast story like film ton mulan snakeeye crazy rich asian highly recommend,Positive
399,like able perfect ooze charm fun akwafinas character doesnt much arc shes fun shang great lead fun aspect feel flesh enough good pace help forget fun intricately shape craft story good enough enough wong,Positive
400,visually outstanding choreography fight scene one greatest ever watch recent movie michelle yeoh every single scene awkwafina funny ever story great plot twist great clue follow next phase mcu,Positive
401,hit somehow succeed expand vast mcu without really force go show richness american pocket world culture go long way solid movie great action sequence cgi deliver mind shangchi without mesmerize tony leung michelle yeoh doesnt fight title character ok awkwafina still isnt funny wait watch tv experience cinema first,Positive
402,,Neutral
403,shangchi legend ten ring different previous marvel movie good thing little worry first film might live success marvel push give film actually spectacular entertain good story good act excellent character development action choreography outstanding funny moment beautiful cinematography vfx major stepup previous marvel film film almost like aquaman mcu fun experience see screen present fan something entirely new unfamiliar movie practically flawless cant wait see shangchi future marvel movie,Positive
404,movie amaze beautiful look awesome action scene well grip story time even pull heart string hand one best marvel film thats ever come far wow darn movie,Positive
405,another mediocre movie die universe fight scene quite good visual mostly ok better capt marvel hence two point,Positive
406,marvel newest solo film introduce iconic hero thier vast collection hero certainly newer fan didnt grow master kungfu even stan lee charge company didnt create shangchi admit comic ripoff bruce lee look style add mystical possible alien influence view mistake true character story reimaging mandarin find disappoint aside tire storyline become common marvel film end little top aside criticism ill give kudos good cast wonderful cinematography ever get faithful adaption marvel comic grow might shock come conclusion film since dont recognize hero villain worse film marvel universe best,Positive
407,shangchi legand ten ring definitely great movie see,Positive
408,must watch movie good enough fun even cinema visuals fight scene great,Positive
409,shangchi legend sumi liu gorgeous totally fine marvel movie like every marvel movie someone upset someone kinder die even though person tell isnt way decide fight kill people revenge someone else teach like kinder person upset say stop use anger solve problem apparently moral woman younger beautiful smarter powerful kinder shouldnt settle even kid end pretty gene destruction reign dad isnt good enough clearly know,Positive
410,ok fctcyycctctcrcrctuvy ty k h h k j f f j h ju u h,Positive
411,,Neutral
412,3rd cinema visit year bring delightful marvel film really enjoy film inspire martial art humor character development emotion also quite spectacular even may thinnk weve see already much visual effect heavy movie come past ten year make marvel pun intend laugh heart goodness much recommend see movie cinema,Positive
413,people give movie review agenda movie honest objective comic version mandarin different power ten ring different make movie bad marvel formula present show different part mcu like black panther important part world build theme movie family expect focus action unique balance story tell action scene get time make sense write review petty thing downplay misrepresent movie agenda see lot nowdays actor good mandarin tony leung chiuwai main reason watch movie disappoint watch movie think enjoy movie masterpeice hold weight fine,Positive
414,incredible start finish cast perfect mind blow special effect cant give enough praise go see,Positive
415,im go downplay movie action visuals comedy much comedy youd expect marvel movie want entertain movie think mcu figure much point oddly enough awkwafina best part movie like better thing ive see main character shangchi really sell movie simu liu knock park perfomance know play everyman chemistry awkwafina work well best scene movie think interest like many marvel character he superhero could regular guy walk street wouldnt know unless know backstory believe also like whole transition face true identity finally confront father main antogonist weakpoints youd expect villain 2dimensional get didnt really care even credit roll fact shangchis father literally thing make relevant story remotely interest even whole ten ring super power didnt completely sell look cool beyond guy metal ring armswhich make himthe powerful man world history sure whatever would say biggest weakpoint story like begin review great visuals action generally entertain movie buti cant help think marvel screenwriter copypasting story previous marvel movie third act borderline rip black panther shame think movie vacuum really something special without element feel regurgitate mcus back catalogue look get sometimes want thing im go stop watch marvel pixar disney cartoon movie liveaction remake personally never hear shangchi comic barely know actor feel le invest preavengers endgame feel odd wait xmen deadpool wolverine iron fist fantastic blade new avenger others join mcu watch wait need many mcu movie guess thats decide,Positive
416,shang chi say first hour enjoyable whole backstory two sibling origin ten ring rival clan martial art also greatbut afraid would 2nd half movie become poor version knock crouch tiger hide silly wire work theatrics make place like two different movie get cut stitch together,Negative
